{
  "analysisLedgerType": "sir-remediation-analysis-index.v1",
  "analyses": [
    {
      "analysisId": "SIR-RA-001",
      "status": "VALID",
      "supersededBy": null,
      "scenarioCoveragePolicy": "plan-only",
      "earnedStates": [
        "EVIDENCED",
        "ANALYSIS_ADMITTED",
        "PLAN_BOUND",
        "FEATURE_NOT_REQUIRED"
      ],
      "planReferences": [
        {
          "planId": "SIR-RP-010",
          "role": "authority"
        },
        {
          "planId": "SIR-RP-800",
          "role": "authority"
        }
      ],
      "scenarioIds": []
    },
    {
      "analysisId": "SIR-RA-002",
      "status": "VALID",
      "supersededBy": null,
      "scenarioCoveragePolicy": "scenario-required",
      "earnedStates": [
        "EVIDENCED",
        "ANALYSIS_ADMITTED",
        "PLAN_BOUND",
        "FEATURE_AUTHORIZED"
      ],
      "planReferences": [
        {
          "planId": "SIR-RP-030",
          "role": "context"
        },
        {
          "planId": "SIR-RP-100",
          "role": "authority"
        },
        {
          "planId": "SIR-RP-700",
          "role": "authority"
        },
        {
          "planId": "SIR-RP-800",
          "role": "context"
        }
      ],
      "scenarioIds": [
        "@sir-package-009"
      ]
    },
    {
      "analysisId": "SIR-RA-003",
      "status": "VALID",
      "supersededBy": null,
      "scenarioCoveragePolicy": "scenario-required",
      "earnedStates": [
        "EVIDENCED",
        "ANALYSIS_ADMITTED",
        "PLAN_BOUND",
        "FEATURE_AUTHORIZED"
      ],
      "planReferences": [
        {
          "planId": "SIR-RP-030",
          "role": "context"
        },
        {
          "planId": "SIR-RP-100",
          "role": "authority"
        },
        {
          "planId": "SIR-RP-300",
          "role": "context"
        },
        {
          "planId": "SIR-RP-700",
          "role": "authority"
        }
      ],
      "scenarioIds": [
        "@sir-admit-007"
      ]
    },
    {
      "analysisId": "SIR-RA-004",
      "status": "VALID",
      "supersededBy": null,
      "scenarioCoveragePolicy": "scenario-required",
      "earnedStates": [
        "EVIDENCED",
        "ANALYSIS_ADMITTED",
        "PLAN_BOUND",
        "FEATURE_AUTHORIZED"
      ],
      "planReferences": [
        {
          "planId": "SIR-RP-030",
          "role": "context"
        },
        {
          "planId": "SIR-RP-100",
          "role": "authority"
        },
        {
          "planId": "SIR-RP-200",
          "role": "authority"
        },
        {
          "planId": "SIR-RP-700",
          "role": "authority"
        }
      ],
      "scenarioIds": [
        "@sir-admit-001",
        "@sir-admit-011"
      ]
    },
    {
      "analysisId": "SIR-RA-005",
      "status": "NOT_ADOPTED",
      "supersededBy": null,
      "scenarioCoveragePolicy": "scenario-required",
      "earnedStates": [
        "EVIDENCED"
      ],
      "planReferences": [
        {
          "planId": "SIR-RP-100",
          "role": "guard"
        },
        {
          "planId": "SIR-RP-200",
          "role": "guard"
        },
        {
          "planId": "SIR-RP-700",
          "role": "guard"
        }
      ],
      "scenarioIds": [
        "@sir-admit-001"
      ]
    },
    {
      "analysisId": "SIR-RA-006",
      "status": "VALID_WITH_REFINEMENT",
      "supersededBy": null,
      "scenarioCoveragePolicy": "scenario-required",
      "earnedStates": [
        "EVIDENCED",
        "ANALYSIS_ADMITTED",
        "PLAN_BOUND",
        "FEATURE_AUTHORIZED"
      ],
      "planReferences": [
        {
          "planId": "SIR-RP-030",
          "role": "context"
        },
        {
          "planId": "SIR-RP-100",
          "role": "authority"
        },
        {
          "planId": "SIR-RP-200",
          "role": "authority"
        },
        {
          "planId": "SIR-RP-300",
          "role": "authority"
        },
        {
          "planId": "SIR-RP-700",
          "role": "authority"
        }
      ],
      "scenarioIds": [
        "@sir-admit-002",
        "@sir-admit-006",
        "@sir-admit-010",
        "@sir-admit-012"
      ]
    },
    {
      "analysisId": "SIR-RA-007",
      "status": "VALID_WITH_REFINEMENT",
      "supersededBy": null,
      "scenarioCoveragePolicy": "scenario-required",
      "earnedStates": [
        "EVIDENCED",
        "ANALYSIS_ADMITTED",
        "PLAN_BOUND",
        "FEATURE_AUTHORIZED"
      ],
      "planReferences": [
        {
          "planId": "SIR-RP-030",
          "role": "context"
        },
        {
          "planId": "SIR-RP-100",
          "role": "authority"
        },
        {
          "planId": "SIR-RP-300",
          "role": "authority"
        },
        {
          "planId": "SIR-RP-700",
          "role": "authority"
        }
      ],
      "scenarioIds": [
        "@sir-admit-005",
        "@sir-admit-006",
        "@sir-admit-010"
      ]
    },
    {
      "analysisId": "SIR-RA-008",
      "status": "VALID_WITH_REFINEMENT",
      "supersededBy": null,
      "scenarioCoveragePolicy": "scenario-required",
      "earnedStates": [
        "EVIDENCED",
        "ANALYSIS_ADMITTED",
        "PLAN_BOUND",
        "FEATURE_AUTHORIZED"
      ],
      "planReferences": [
        {
          "planId": "SIR-RP-030",
          "role": "context"
        },
        {
          "planId": "SIR-RP-100",
          "role": "authority"
        },
        {
          "planId": "SIR-RP-300",
          "role": "authority"
        },
        {
          "planId": "SIR-RP-700",
          "role": "authority"
        }
      ],
      "scenarioIds": [
        "@sir-admit-003",
        "@sir-admit-004",
        "@sir-admit-008",
        "@sir-admit-009"
      ]
    },
    {
      "analysisId": "SIR-RA-009",
      "status": "VALID",
      "supersededBy": null,
      "scenarioCoveragePolicy": "scenario-required",
      "earnedStates": [
        "EVIDENCED",
        "ANALYSIS_ADMITTED",
        "PLAN_BOUND",
        "FEATURE_AUTHORIZED"
      ],
      "planReferences": [
        {
          "planId": "SIR-RP-030",
          "role": "context"
        },
        {
          "planId": "SIR-RP-100",
          "role": "authority"
        },
        {
          "planId": "SIR-RP-300",
          "role": "authority"
        },
        {
          "planId": "SIR-RP-700",
          "role": "authority"
        }
      ],
      "scenarioIds": [
        "@sir-admit-003",
        "@sir-admit-004",
        "@sir-admit-005"
      ]
    },
    {
      "analysisId": "SIR-RA-010",
      "status": "VALID_WITH_REFINEMENT",
      "supersededBy": null,
      "scenarioCoveragePolicy": "scenario-required",
      "earnedStates": [
        "EVIDENCED",
        "ANALYSIS_ADMITTED",
        "PLAN_BOUND",
        "FEATURE_AUTHORIZED"
      ],
      "planReferences": [
        {
          "planId": "SIR-RP-030",
          "role": "context"
        },
        {
          "planId": "SIR-RP-100",
          "role": "authority"
        },
        {
          "planId": "SIR-RP-300",
          "role": "authority"
        },
        {
          "planId": "SIR-RP-700",
          "role": "authority"
        }
      ],
      "scenarioIds": [
        "@sir-admit-003",
        "@sir-admit-007",
        "@sir-admit-008",
        "@sir-admit-009"
      ]
    },
    {
      "analysisId": "SIR-RA-011",
      "status": "VALID_WITH_REFINEMENT",
      "supersededBy": null,
      "scenarioCoveragePolicy": "scenario-required",
      "earnedStates": [
        "EVIDENCED",
        "ANALYSIS_ADMITTED",
        "PLAN_BOUND",
        "FEATURE_AUTHORIZED"
      ],
      "planReferences": [
        {
          "planId": "SIR-RP-030",
          "role": "context"
        },
        {
          "planId": "SIR-RP-100",
          "role": "authority"
        },
        {
          "planId": "SIR-RP-400",
          "role": "authority"
        },
        {
          "planId": "SIR-RP-700",
          "role": "authority"
        }
      ],
      "scenarioIds": [
        "@sir-admit-013",
        "@sir-admit-014"
      ]
    },
    {
      "analysisId": "SIR-RA-012",
      "status": "VALID_WITH_REFINEMENT",
      "supersededBy": null,
      "scenarioCoveragePolicy": "scenario-required",
      "earnedStates": [
        "EVIDENCED",
        "ANALYSIS_ADMITTED",
        "PLAN_BOUND",
        "FEATURE_AUTHORIZED"
      ],
      "planReferences": [
        {
          "planId": "SIR-RP-030",
          "role": "context"
        },
        {
          "planId": "SIR-RP-100",
          "role": "authority"
        },
        {
          "planId": "SIR-RP-400",
          "role": "authority"
        },
        {
          "planId": "SIR-RP-700",
          "role": "authority"
        }
      ],
      "scenarioIds": [
        "@sir-admit-013",
        "@sir-admit-014"
      ]
    },
    {
      "analysisId": "SIR-RA-013",
      "status": "VALID_WITH_REFINEMENT",
      "supersededBy": null,
      "scenarioCoveragePolicy": "scenario-required",
      "earnedStates": [
        "EVIDENCED",
        "ANALYSIS_ADMITTED",
        "PLAN_BOUND",
        "FEATURE_AUTHORIZED"
      ],
      "planReferences": [
        {
          "planId": "SIR-RP-030",
          "role": "context"
        },
        {
          "planId": "SIR-RP-100",
          "role": "authority"
        },
        {
          "planId": "SIR-RP-400",
          "role": "authority"
        },
        {
          "planId": "SIR-RP-700",
          "role": "authority"
        }
      ],
      "scenarioIds": [
        "@sir-admit-014",
        "@sir-admit-015",
        "@sir-admit-016",
        "@sir-admit-017"
      ]
    },
    {
      "analysisId": "SIR-RA-014",
      "status": "VALID_WITH_REFINEMENT",
      "supersededBy": null,
      "scenarioCoveragePolicy": "scenario-required",
      "earnedStates": [
        "EVIDENCED",
        "ANALYSIS_ADMITTED",
        "PLAN_BOUND",
        "FEATURE_AUTHORIZED"
      ],